"date_time","channel","sp_title","original_title","year","genre","country","length","description","director","writer","photography","music","producer","production_company","actors"
2022-09-13 00:19:00,"Paramount Network","Vanilla Sky","Vanilla Sky",2001,"Drama","Estados Unidos",130,"David Aames se convirtió en todo un magnate tras heredar de su padre una importante industria editorial. Ahora sus prioridades son mantenerse joven y estar con mujeres bonitas, como su amiga eventual Julie Gianni. Durante su fiesta de cumpleaños, aparece en escena Sofía, una bailarina española por la que se siente increíblemente atraído. Los celos de su amiga eventual provocan una venganza y un terrible accidente. Revisión yanqui de ''Abre los ojos'', el thriller romántico dirigido en 1997 por Alejandro Amenábar. Esta nueva versión se realizó gracias a la insistencia de Tom Cruise, que se hizo con los derechos del filme y quien, además de protagonizarlo, también ejerció de productor. El realizador Cameron Crowe, que ya había trabajado con Cruise en ''Jerry Maguire'', aceptó dirigir la película. La cinta finalmente trascendió lo meramente cinematográfico, ya que dio pie a una relación sentimental entre Cruise y Penélope Cruz, quien repite el papel que interpretara en la original.",NA,NA,NA,NA,NA,NA,NA
2022-09-13 00:42:00,"Neox","Ruslan: la venganza del asesino","Driven to Kill",2009,"Acción","Canadá",98,"La hija de un gánster ruso retirado, que en la actualidad se dedica a escribir novelas de crimen, va a casarse con el hijo de su mayor enemigo. Cuando Ruslan se entera, decide volver de nuevo a la carrera criminal ya que su familia se ve amenazada. El incansable Steven Seagal (''Por encima de la ley'', ''Alerta máxima'') protagoniza este lanzamiento directo a vídeo, un título de acción fiel a su estilo de películas sobre venganza, golpes, tiroteos, mafia rusa y peleas. Seagal es uno de los iconos del cine de acción junto a otras figuras como Sylvester Stallone (''Rocky'', ''John Rambo''), Chuck Norris (''Walter, Texas Ranger''), Arnold Schwarzenegger (''Terminator'', ''Depredador'') o Jean-Claude Van Damme (''Soldado universal'', ''Máximo riesgo''). El actor, nacido en 1951, es experto en artes marciales, en Kendo y en Karate. Con 17 años se mudó a Japón y ofreció clases de inglés para poder seguir pagando sus estudios. Consiguió el cinturón negro y se alzó como el primer occidental en dirigir su propia escuela Aikidö en Japón.",NA,NA,NA,NA,NA,NA,NA
2022-09-13 01:10:00,"laSexta","La mujer del pastor","The Pastor's Wife",2011,"Drama","Canadá",87,"El pastor de una pequeña localidad es asesinado en su casa y la esposa es detenida ante la mirada incrédula de los vecinos. La policía investiga que la ha podido llevar a tan dramática determinación y las autoridades se hacen cargo de la custodia de los niños. Telefilme de drama y misterio basado en los hechos reales recogidos en el libro con el mismo título de la escritora Diane Fanning. Fanning tiene una larga lista de novelas que relatan crímenes reales ocurridos en Estados Unidos que publica con la editorial St. Martin's Press. En esta ocasión, la cineasta Norma Bailey (''Falcon Beach'') recupera el caso de la ama de casa Mary Winkler asesinó a su marido en 2006 en su casa de Tennesee y fue condenada a 210 años de prisión. La cinta rodada en Vancouver y estrenada en la cadena de televisión Lifetime está protagonizada por la actriz Rose McGowan, conocida internacionalmente por su papel en la serie de televisión ''Embrujadas''. McGowan interpretó a Paige Matthews, la más pequeña de las hermanas, un papel que le mereció un galardón en los Family Television Awards (premios anuales que reconocen el buen trabajo en la televisión familiar).",NA,NA,NA,NA,NA,NA,NA
2022-09-13 13:10:00,"La 2","El sonido de un tambor","Cimarron: The Sound of a Drum",1968,"Western","Estados Unidos",70,"El problemático sargento Clay Tyce tiene la misión de patrullar los alrededores en busca de cuatreros, pero él elude su deber y se va a la taberna. Una de las muchas películas de la saga de ''Cimarrón'' que se hicieron en la década de 1960 para la televisión. Se trata de un wéstern, un género que ya no gozaba de tanta popularidad en el celuloide, pero que estaba en boga en la pequeña pantalla, gracias a series como ''El Virginiano'' o ''Wagon Train''. Al igual que las películas predecesoras de esta franquicia, el trío protagonista sigue estando formado por un rostro habitual de las propuestas del Oeste, Stuart Whitman (''Los comancheros''); Jill Townsend (''Poldark'') y el británico Percy Herbert, quien era más conocido por sus trabajos en el cine bélico (''Los cañones de Navarone'', ''El puente sobre el río Kwai''). Como curiosidad, parte de la banda sonora corre a cargo del multilaureado Maurice Jarre, ganador de tres Oscars, por sus bellas partituras en ''Lawrence de Arabia'', ''Doctor Zhivago'' y ''Pasaje a la India''.",NA,NA,NA,NA,NA,NA,NA
2022-09-13 16:05:00,"TRECE","Comando secreto","The Secret War of Harry Frigg",1968,"Comedia","Estados Unidos",110,"El soldado Harry Frigg es un indisciplinado soldado americano que ha convertido las fugas de las prisiones militares en su especialidad. Por eso, cuando cinco generales aliados caen en manos de los nazis, el Alto Mando americano le confía la misión de rescatarlos. El plan consiste en que Frigg se deje capturar por el enemigo, para ayudar a los generales a fugarse. Pero para que lo encierren con ellos, Frigg debe ser antes ascendido también a general. Todo funciona como está previsto, hasta que una bella condesa se cruza en el camino de Harry, haciéndole dudar de su misión. Una película menor dentro de la filmografía de Paul Newman, en la que el actor interpretó uno de sus arquetipos favoritos: el que ya había bordado en ''La leyenda del indomable''. Se trata de una comedia bélica dirigida por Jack Smight, impersonal pero eficaz cineasta que ya había trabajado con Newman en uno de sus grandes éxitos: ''Harper, investigador privado''. Dando la réplica al actor encontramos a la croata Sylva Koscina, una estrella del cine europeo que a finales de los 60 protagonizó varias producciones de Hollywood.",NA,NA,NA,NA,NA,NA,NA
2022-09-13 16:20:00,"La 1","La cuchara de Elli","Tessa Hennig - Elli gibt den Löffel ab",2012,"Drama","Alemania",90,"Elli es una mujer viuda, se siente sola y está en bancarrota, hasta que hereda una pensión en Capri. En el lugar, conoce al encantador trotamundos Heinz, pero también a su codiciosa hermana Dorothea.",NA,NA,NA,NA,NA,NA,NA
2022-09-13 16:37:00,"El Toro TV","Idilio en septiembre","September Affair",1950,"Drama","Estados Unidos",104,"David y Marianne se conocen en un viaje y se enamoran. La gente cree que han muerto en un accidente de avión, pero ellos están a salvo y aprovechan la ocasión para mantener su relación en secreto.",NA,NA,NA,NA,NA,NA,NA
2022-09-13 18:20:00,"TRECE","La novia salvaje","Many Rivers to Cross",1955,"Comedia","Estados Unidos",94,"Bushrod, un cazador de pieles que se dirige a Canadá, conoce a una muchacha que busca marido, miembro de una familia asilvestrada. La muchacha, llamada Mary, y su padre, que siempre va armado hasta los dientes, perseguirán al joven cazador de trampas hasta dar con él y poder llevar a cabo su plan de matrimonio. Un ?western' menor, de contenido abiertamente cómico y romántico, del director Roy Rowland, especialista durante largo tiempo en este tipo de filmes y uno de los pioneros del cine del Oeste que se veían en España. Encabezan el reparto Robert Taylor, héroe por excelencia del cual la MGM supo explotar su físico y su aire romántico en filmes de corte medieval, y Eleanor Parker, la estrella indiscutible de la Warner durante las décadas cuarenta y cincuenta.",NA,NA,NA,NA,NA,NA,NA
2022-09-13 22:25:00,"Paramount Network","Noche y día","Knight and Day",2010,"Acción","Estados Unidos",110,"Miller es un agente secreto que huye de los delincuentes que se han interpuesto en su arriesgada misión. En su camino se cruza June, una joven que acaba atrapada entre el espía y aquellos que lo persiguen. Tom Cruise vuelve a meterse en la piel de un espía en apuros, aunque esta vez no lo hace de la mano del agente Ethan Hunt, protagonista de la saga cinematográfica ''Misión Imposible''. El conocido actor, que abandonó el proyecto de ''The Tourist'' para participar en la que nos ocupa, se enrola de nuevo en una cinta cargada de acción y comedia, compartiendo cartel para la ocasión con Cameron Díaz (''Algo pasa con Mary''), rubia predilecta de las comedias románticas de Hollywood. Ambos hicieron la mayoría de escenas peligrosas del filme. A pesar de que en un principio la película estaba en manos de Tom Dey, quien ya tenía experiencia mezclando adrenalina y humor con ''Shanghai Kid. Del este al oeste'', al final las riendas de la dirección recayeron en James Mangold (''El tren de las 3:10''). Como curiosidad, en España generó polémica porque en la cinta se ambienta la festividad de los sanfermines en Sevilla y Cádiz.",NA,NA,NA,NA,NA,NA,NA
2022-09-13 22:30:00,"Neox","Millennium: Lo que no te mata te hace más fuerte","The Girl in the Spider's Web",2018,"Suspense / Thriller","Estados Unidos",117,"La joven 'hacker' informática Lisbeth Salander y el periodista Mikael Blomkvist se ven atrapados en una red de espías, 'ciberdelincuentes' y funcionarios corruptos del gobierno. Adaptación de la novela ''Lo que no te mata te hace más fuerte'' de David Lagercrantz, una continuación literaria de la saga 'Millennium' creada originalmente por Stieg Larsson. Fede Álvarez (''Posesión infernal'') dirige la secuela de ''Los hombres que no amaban a las mujeres'' de 2011, que fue obra de David Fincher (''El curioso caso de Benjamin Button''). La cinta de acción, suspense y drama cuenta con un nuevo reparto para la nueva aventura de Lisbeth Salander. La protagonista es en esta ocasión la actriz británica Claire Foy, conocida por interpretar a la reina Isabel II en la exitosa serie de Netflix ''The Crown'', cuyo papel le hizo merecedora de un Globo de Oro. El rodaje de la coproducción duró alrededor de seis meses y tuvo lugar entre Alemania y Suecia.",NA,NA,NA,NA,NA,NA,NA
2022-09-13 22:30:00,"laSexta","Indiana Jones y la última cruzada","Indiana Jones and the Last Crusade",1989,"Aventuras","Estados Unidos",127,"El millonario Walter Donovan contrata al intrépido aventurero y arqueólogo Indiana Jones para que encuentre el mítico Santo Grial, la copa que utilizó Jesús en la Última Cena. La persona que más datos ha recopilado sobre el tema es, precisamente, el padre de Indiana. Pero este ha desparecido misteriosamente mientras trabajaba también para Donovan. Pronto, Indy descubrirá que detrás de todo el asunto están sus más odiados enemigos, los nazis. Ocho años después de ''En busca del arca perdida'', Steven Spielberg dirigió otra vez a Harrison Ford en la tercera entrega de la saga. En esta ocasión, Ford contó con un compañero de aventuras de lujo, el actor Sean Connery, en el papel de su padre. La química entre ambos personajes es uno de los aspectos más destacables de esta película. Esta tercera parte de la saga guarda muchos aspectos en común con la primera, desde tener a los nazis como enemigos, hasta la búsqueda de un objeto simbólico del cristianismo, en esta ocasión el Santo Grial. La película cosechó un enorme éxito de taquilla y ganó un Óscar por sus efectos sonoros en la edición de 1989.",NA,NA,NA,NA,NA,NA,NA
2022-09-14 00:34:00,"Paramount Network","Clover","Clover",2020,"Comedia","Estados Unidos",101,"Dos hermanos huyen de un mafioso al que deben dinero, y por el camino se encuentran a una adolescente perseguida por asesinos profesionales. ''Clover'' es una comedia negra de acción, el estilo de la misma recuerda al mismísimo Tarantino de los años 90. Mark Webber, Nicole Elizabeth Berger y Jon Abrahams son los encargados de protagonizar el largometraje, en el que aparecen dos secundarios de lujo como Ron Perlman y Chazz Palminteri. Jon Abrahams, a parte de interpretar a Mickey, es el director de este filme. La primera vez que lo hizo fue en 2016, cuando dirigió y protagonizó el drama ''All at Once''.",NA,NA,NA,NA,NA,NA,NA
2022-09-14 00:48:00,"Neox","Toda la verdad","High Crimes",2002,"Suspense / Thriller","Estados Unidos",105,"Claire, una dinámica abogada, y su marido, un contratista de éxito con su propio negocio, viven en la idílica Marin County. Están locamente enamorados y piensan seriamente en ampliar la familia. Pero un delito casual en su casa provoca una sucesión de acontecimientos que rompe en pedazos su mundo. El realizador Carl Franklin (''El demonio vestido de azul'') fue el responsable de este thriller dramático construido a raíz de la novela homónima de Joseph Finder. Este autor está considerado como un experto en temas relacionados con la CIA y con la política internacional y sus obras han sido elogiadas por su mezcla de incesante suspense e intriga política. A pesar de las altas expectativas, la cinta logró convencer al público, pues recaudó unas cifras nada desdeñables. También destacan las aportaciones y el carisma de sus protagonistas, un Morgan Freeman y una Ashley Judd que volvieron a compartir cartel tras ''El coleccionista de amantes''. No menos destacable fue el reparto de secundarios, que incluye nombres como James Caviezel (''La pasión de Cristo''), Bruce Davison (''X-Men'') o Amanda Peet (''Melinda y Melinda'').",NA,NA,NA,NA,NA,NA,NA
2022-09-14 01:10:00,"laSexta","Oscuro secreto","Jodi Arias: Dirty Little Secret",2013,"Suspense / Thriller","Estados Unidos",89,"El carismático y atractivo líder de una comunidad de mormones muere asesinado y todas las sospechas recaen sobre Jody Arias. Ambos mantenían una extraña relación desde que ella le esperó en la puerta de un hotel en el que él impartía una conferencia. Debido a las estrictas normas de la religión mormona, Travis se ve obligado a mantener la relación con Jody en secreto, lo que le lleva a enfrentarse a un dilema entre su religión y el atractivo de la mujer. Película dirigida por Jace Alexander, afamado director de telefilmes y series de televisión norteamericanas como ''Ley y orden'', ''Rescue Me'' o ''Carry Me Home''. El reparto lo encabezan Tania Raymonde(''La matanza de Texas 3D'')y Jesse Lee Soffer (''The Mob Doctor''). Ambos actores eran ya conocidos por sus papeles en distintas series de televisión y su participación en películas, sin embargo es la primera vez que dan vida a personajes protagonistas. Tras su estreno en 2013, el telefilme obtuvo buenas críticas para los actores protagonistas por su forma de interpretar la relación entre Travis y Jody, así como el posterior juicio por asesinato. Como curiosidad, cabe destacar que la película fue grabada en tan solo 16 días.",NA,NA,NA,NA,NA,NA,NA
2022-09-14 04:50:00,"Paramount Network","Querido fotogramas","Querido fotogramas",2018,"Documentales","España",76,"Actores, directores, periodistas y críticos del mundo del cine se embarcan, a través de las cartas de Mr. Belvedere, en un emocionante viaje por la historia del cine español. Para celebrar el 70 aniversario de la revista ''Fotogramas'', ''Querido fotogramas'' se centra en las cartas que los lectores han enviado a la publicación durante todos estos años. Entre los famosos que encontramos en este documental encontramos a Isabel Coixet, Belén Rueda, Javier Bardem, José Sacristán o Concha Velasco, entre otras caras conocidas. El encargado de escribir y dirigir este homenaje es Sergio Oksman, realizador premiado por sus trabajos en Festivales como el de Buenos Aires, Karlovy Vary o Clermont-Ferrand. También obtuvo el Goya a Mejor Cortometraje Documental por ''A Story for the Modlins'' en 2012. ''Fotogramas'' es una revista española de periodicidad mensual que trata todos los aspectos del mundo del cine. Su primer número se publicó el 15 de noviembre de 1946 de la mano del matrimonio formado por Antonio Nadal-Rodó y María Fernanda Gañán.",NA,NA,NA,NA,NA,NA,NA
2022-09-14 12:40:00,"La 2","El halcón y la presa","La resa dei conti",1966,"Western","Italia",105,"Jonathan Corbett es un cazador de recompensas de Texas que persigue a Cuchillo Sánchez, un joven mejicano acusado de la violación y el asesinato de una niña de 12 años, ocurrido en la frontera entre México y Estados Unidos. Un spaghetti western protagonizado una de las grandes estrellas del género como Lee Van Cleef y dirigido por Sergio Sollima, cineasta italiano famoso por la recordada miniserie de TV, ''Sandokan''. Dada la popularidad que alcanzaron las aventuras de uno de los personajes del filme que nos ocupa, Sollima y el actor que le daba vida, el italocubano Tomás Milian, realizaron una secuela tres años después titulada ''Corre, Cuchillo, corre''.",NA,NA,NA,NA,NA,NA,NA
2022-09-14 16:10:00,"TRECE","Sindicato de asesinos","A Lovely Way to Die",1968,"Drama","Estados Unidos",103,"Schuyler es un policía poco ortodoxo que acostumbra a emplear la violencia en sus detenciones. Consciente de su problema e influido por los numerosos toques de atención recibidos por sus superiores, decide entregar su placa. Pero pronto tendrá que volver al servicio cuando un juez se dé cuenta de que es el hombre ideal para proteger a una joven y bella viuda. El prolífico director estadounidense David Lowell Rich se encarga de esta película de acción que combina elementos del cine de misterio y bebe de las producciones de espías de la década de los 60 y que por entonces gozaban de un notable interés. El filme recibió una calurosa acogida por parte del público y consiguió elevar la cifra de espectadores por encima del millón, algo poco habitual. Los buenos resultados cosechados también responden al reparto. El legendario Kirk Douglas comparte cartel con la italiana Sylva Koiscina (''Julieta de los espíritus'', ''Hércules encadenado''), estandarte del destape en los 60.",NA,NA,NA,NA,NA,NA,NA
2022-09-14 16:20:00,"La 1","Inga Lindstrom: Baila conmigo","Inga Lindström: Tanz mit mir",2017,"Drama","Alemania",89,"La profesora de baile Eva Manstein, junto a su hija Lissi y su madre Meret, debe abandonar su apartamento debido a unos nuevos propietarios. Esto supone que también pierda su amado estudio de baile.",NA,NA,NA,NA,NA,NA,NA
2022-09-14 16:49:00,"El Toro TV","Hogar, dulce hogar","Room for One More",1952,"Comedia","Estados Unidos",98,"Anne y George 'Poppy' Rose forman una típica familia norteamericana junto a sus hijos, tres niños muy traviesos. Anne, que tiene un gran corazón, ha convertido el hogar familiar en un refugio para perros y gatos sin techo. Un día también decide acoger a Jane, una huérfana problemática que ha intentado suicidiarse. Al principi, 'Poppy' se opone, pero poco a poco conseguirán que la chica se integre en la familia. Una comedia con toques de melodrama para toda la familia, en la que Cary Grant compartió protagonismo con su entonces esposa Betsy Drake (''La segunda mujer''). El éxito de la película inspiró una serie de televisión basada en la misma, con los mismos personajes interpretados por distintos actores.",NA,NA,NA,NA,NA,NA,NA
2022-09-14 18:35:00,"TRECE","Emboscada","Yellowstone Kelly",1959,"Western","Estados Unidos",91,"Yellowstone Kelly, un cazador retraído y solitario, llega a Fort Wilford para vender sus pieles. Rechaza el ofrecimiento del comandante de convertirse en guía de una expedición en territorio de los sioux. De vuelta a su cabaña, acompañado por un joven que ha intimado con él, son atacados por los indios, que los llevan a su campamento. Una de las películas menos conocidas de Gordon Douglas, un cineasta de extensa carrera en Hollywood, durante la cual trató prácticamente todos los géneros. Si bien a Douglas se le reconoce sobre todo por la famosa ''La humanidad en peligro'', un clásico del cine fantástico, el director también rodó westerns. ''Emboscada'' es uno de ellos, y pertenece a aquellos en los que aparecen los indios, en este caso los sioux. Sin nada especial que comentar de la película, más que es un excelente producto de acabado artesanal y que cumple las expectativas de entretener, lo cierto es que es digno de mención el rodaje en exteriores, mediante el cual puede gozarse de los extensos parajes desiertos de Arizona.",NA,NA,NA,NA,NA,NA,NA
2022-09-14 22:05:00,"La 2","Se llamaba Grace Kelly","Elle s'appelait Grace Kelly",2019,"Documental","Francia",52,"Considerada una de las actrices más bellas de su tiempo, Grace Kelly sigue siendo un icono en la actualidad. Su vida y carrera son conocidas mundialmente, desde su trabajo en Hollywood hasta su matrimonio con el Príncipe Rainiero y su trágica muerte en un accidente de coche en 1982. Pero, ¿conocemos la historia interna? ¿Quién era realmente Grace Kelly? Gracias a un acuerdo exclusivo con el Principado de Mónaco, este documental contará la historia de Grace como nunca antes se había contado, a través de los ojos de quienes la amaban, incluida su familia, en particular el Príncipe Alberto de Mónaco, y otros amigos. Muestra tanto a Rainiero como a Grace en palacio, pero también en su residencia privada de verano, Monte Agel, y en el Castillo de Marchais, de la familia Grimaldi. Por primera vez, la familia Grimaldi ha dado acceso a sus archivos privados, muchos de los cuales nunca antes se habían hecho públicos. Se trata de muchas películas rodadas en 8mm, 16mm y super-8 por Grace Kelly y el propio Rainiero, que revelan a una madre bastante diferente a la imagen oficial: libre, vibrante, rodeada de sus hijos y participando en la vida familiar.",NA,NA,NA,NA,NA,NA,NA
2022-09-14 22:25:00,"Paramount Network","Breakdown","Breakdown",1997,"Suspense / Thriller","Estados Unidos",93,"Durante un viaje, una avería deja tirados a Jeff y Amy en mitad del desierto. Un camionero les ofrece una ayuda que el matrimonio acepta encantado. Sin embargo, el remedio será peor que la enfermedad. ''Breakdown'' fue el segundo trabajo como realizador de Jonathan Mostow (''U-571''), un combinado de acción y suspense que se convirtió en una de las películas más taquilleras de 1997 en España. La cinta se basa en una temática muchas veces llevada a la gran pantalla, la del secuestro, y es fácil reconocer en él influencias de títulos como ''Frenético'' o ''Carretera al infierno''. Mostow encargó los papeles protagonistas a la pareja formada por Kurt Russell y Kathleen Quinlan (''Apolo 13''), mientras que el papel del perverso camionero recayó en el siempre correcto JT Walsh, quien falleció un año después del estreno de la cinta.",NA,NA,NA,NA,NA,NA,NA
2022-09-14 22:30:00,"Neox","Shooter: El tirador","Shooter",2007,"Acción","Estados Unidos",124,"Bob es un tirador de élite que abandona las fuerzas armadas después de que una misión extraoficial no saliera como estaba prevista. Muy a su pesar, le obligan a volver. Antoine Fuqua, quien ya había coqueteado con la acción en ''El rey Arturo'' y con el thriller en ''Training Day: día de entrenamiento'', decidió unir ambos géneros para crear esta película basada en la novela de Stephen Hunter ''Point of Impact''. A pesar de que el protagonista del libro casaba más, por edad, con Clint Eastwood, Robert Redford o Harrison Ford, el cineasta acabó dando el rol a un Mark Wahlberg que tuvo que perder nueve kilos para tener una figura menos musculosa y, por lo tanto, más realista. El intérprete de ''The Fighter'' se tuvo que entrenar con un antiguo francotirador de la marina estadounidense para dar credibilidad a sus movimientos. Como curiosidad, el nombre del personaje Bob Lee Swagger es un homenaje a la teoría conspirativa que asegura que los asesinos tienen tres nombres, como Lee Harvey Oswald (presunto autor de los disparos contra Kennedy), Mark David Chapman (quien mató a Lennon), James Earl Ray (declarado culpable de la muerte de Luther King) o John Wilkes Booth (asesino de Lincoln).",NA,NA,NA,NA,NA,NA,NA
2022-09-14 22:56:00,"La 2","Grace Kelly: Los millones perdidos","Grace Kelly: The Missing Millions",2021,"Documental","Reino Unido",45,"La investigadora financiera Gemma Godfrey revisa documentos descubriendo la verdad detrás de los millones perdidos de Grace Kelly.",NA,NA,NA,NA,NA,NA,NA
2022-09-15 00:20:00,"Paramount Network","¡Viven!","Alive",1993,"Drama","Estados Unidos",123,"Un avión uruguayo con 45 pasajeros, la mayoría de ellos jugadores de un equipo de rugby, se estrella en la cordillera de los Andes. Milagrosamente, muchos de sus ocupantes sobreviven y se organizan mientras esperan el rescate. Sin embargo, pasan los días y los muchachos no ven que nadie les venga a buscar. Basada en un hecho real que conmocionó al mundo en 1972, la tragedia de los Andes fue narrada por el escritor Piers Paul Read en un libro que se convirtió en versión oficial autorizada por los supervivientes. La negociación de la novela incluyó también los derechos para la filmación de la película que dirigió Frank Marshall (''Aracnofobia''). En el filme se narran las vivencias de estos jóvenes que pasaron 72 días en condiciones extremas y que solo fueron rescatados después de que dos de ellos cruzaran la cordillera en busca de ayuda. La cinta cuenta con un narrador de lujo, John Malkovich, y con la presencia de Ethan Hawke (''Reality Bites'') en el papel de Nando Parrado, convertido en un héroe después de esta tragedia.",NA,NA,NA,NA,NA,NA,NA
2022-09-15 00:40:00,"La 2","Las tentaciones de Justo","Las tentaciones de Justo",2021,"Documental","España",65,"La muerte acecha a Justo Gallego, un labrador español que se convirtió en arquitecto por amor a Dios. Su vida se apaga con la incertidumbre sobre el futuro de una obra inacabada e incomprendida.",NA,NA,NA,NA,NA,NA,NA
